<?xml version="1.0"?>
<!DOCTYPE users SYSTEM "../dtd/users.dtd">
<users>
<user id="u1"><email>goldlif94@gmail.com</email><password>d515c93fa586820e829431093234420e</password><displayName>roger</displayName><avatar>storage/avatars/avatar_default.png</avatar><status>online</status><contacts><contact>u2</contact></contacts></user><user id="u2"><email>zal.diop@gmail.com</email><password>d515c93fa586820e829431093234420e</password><displayName>zal</displayName><avatar>storage/avatars/avatar_default.png</avatar><status>online</status><contacts><contact>u1</contact></contacts></user></users>
